,CO_MUNICIPIO,CO_ENTIDADE,NO_ENTIDADE,TP_LOCALIZACAO,TP_OCUPACAO_PREDIO_ESCOLAR
61214,MARACANAU,23225351,DULCE IRMA EMEIEF,URBANA,CEDIDO
67817,MARACANAU,23251255,MARILENE LOPES RABELO PROFESSORA EMEIEF,URBANA,ALUGADO
68738,MARACANAU,23080590,JOSE ASSIS DE OLIVEIRA EMEIEF,URBANA,PROPRIO
69068,MARACANAU,23081180,NAPOLEAO BONAPARTE VIANA EMEIEF,URBANA,PROPRIO
69306,MARACANAU,23270900,FRANCISCA FLORENCIA DA SILVA PROFª EMEIEF,URBANA,ALUGADO
71578,MARACANAU,23564105,MARIA JOSE HOLANDA DO VALE PROF EMEIEF,URBANA,ALUGADO
72668,MARACANAU,23222883,OSMIRA EDUARDO DE CASTRO CRECHE MUNICIPAL,URBANA,CEDIDO
80904,MARACANAU,23270985,FRANCISCO ARAUJO DO NASCIMENTO PROF EMEIEF,URBANA,ALUGADO
